{"algorithm":"ai-sow-owner-test-descriptor-v1","contractVersion":"0.2","negativeCases":[{"caseId":"N07","expected":{"diagnosticCodes":["INTEGRATION_COVERAGE_MISSING","INTEGRATION_REF_UNKNOWN"],"outcome":"BLOCKED","owner":"generate-task","sideEffects":{}},"mutation":{"op":"replace-field","selector":{"collection":"tasks","field":"integrationId","id":"task-erp-reservation-integration","idField":"taskId","path":".ai-sow/data/generate-task/estimate.json"},"value":"integration-unknown"}},{"caseId":"N08","expected":{"diagnosticCodes":["OWNER_RECEIPT_INPUT_MISMATCH"],"outcome":"BLOCKED","owner":"generate-task","sideEffects":{"package":"NOT_PUBLISHED"}},"mutation":{"op":"append-object","selector":{"collection":"uncertainties","path":".ai-sow/data/analyze-as-is/asis.json"},"value":{"affectsEstimate":true,"impact":"SIMULATED estimate impact.","name":"SIMULATED estimate uncertainty","owner":"SIMULATED_OWNER","question":"SIMULATED unresolved estimate input?","recommendedHandling":"SIMULATED owner decision required.","relatedFeatureIds":["feature-customer-profile"],"topic":"DELIVERY_CONSTRAINTS","uncertaintyId":"uncertainty-simulated-n08"}}}],"ownerSkill":"generate-task","positive":{"operations":[{"op":"append-object","selector":{"collection":"tasks","path":".ai-sow/data/generate-task/estimate.json"},"value":{"acceptanceCriterionIds":["ac-simulated-scheduler-six-environment"],"baseUnit":"BU-RUNTIME-ENV","complexity":"M","name":"SIMULATED Scheduler six-environment configuration","rationale":"SIMULATED_SCHEDULER atomic Task.","storyId":"story-order-state","taskId":"task-simulated-scheduler-six-environment","workMode":"新建","workModeRationale":"SIMULATED six-environment Scheduler delivery."}},{"op":"append-object","selector":{"collection":"tasks","path":".ai-sow/data/generate-task/estimate.json"},"value":{"acceptanceCriterionIds":["ac-simulated-debezium-six-environment"],"baseUnit":"BU-RUNTIME-ENV","complexity":"M","name":"SIMULATED Debezium six-environment configuration","rationale":"SIMULATED_DEBEZIUM atomic Task.","storyId":"story-order-state","taskId":"task-simulated-debezium-six-environment","workMode":"新建","workModeRationale":"SIMULATED six-environment Debezium delivery."}},{"op":"append-object","selector":{"collection":"tasks","path":".ai-sow/data/generate-task/estimate.json"},"value":{"acceptanceCriterionIds":["ac-simulated-double-enable-fail-closed"],"baseUnit":"BU-CONFIG-FEATURE-FLAG","complexity":"M","name":"SIMULATED double-enable fail-closed control","rationale":"SIMULATED_DOUBLE_ENABLE_FAIL_CLOSED atomic Task.","storyId":"story-order-state","taskId":"task-simulated-double-enable-fail-closed","workMode":"新建","workModeRationale":"SIMULATED fail-closed control is delivered separately."}},{"op":"append-object","selector":{"collection":"tasks","path":".ai-sow/data/generate-task/estimate.json"},"value":{"acceptanceCriterionIds":["ac-production-preparation"],"baseUnit":"BU-INTERNAL-INTEGRATION","complexity":"M","integrationId":"integration-simulated-production-threshold","name":"SIMULATED production threshold integration","rationale":"SIMULATED threshold Integration Task.","storyId":"story-production-preparation","taskId":"task-simulated-production-threshold-integration","workMode":"新建","workModeRationale":"SIMULATED test-only threshold delivery."}},{"op":"replace-field","selector":{"approvalEvidence":"SIMULATED UAT APPROVAL — NOT PRODUCTION","field":"验证状态/说明","keyField":"参数代码","keyValue":"K_UAT","mediaType":"xlsx-table","path":".ai-sow/templates/sow-template.xlsx","table":"ProjectParameterTable"},"value":"已批准"},{"op":"replace-field","selector":{"approvalEvidence":"SIMULATED INTERNAL SIT APPROVAL — NOT PRODUCTION","field":"验证状态/说明","keyField":"参数代码","keyValue":"SIT_INT_SUPPORT","mediaType":"xlsx-table","path":".ai-sow/templates/sow-template.xlsx","table":"ProjectParameterTable"},"value":"已批准"},{"op":"replace-field","selector":{"approvalEvidence":"SIMULATED EXTERNAL SIT APPROVAL — NOT PRODUCTION","field":"验证状态/说明","keyField":"参数代码","keyValue":"SIT_EXT_SUPPORT","mediaType":"xlsx-table","path":".ai-sow/templates/sow-template.xlsx","table":"ProjectParameterTable"},"value":"已批准"}]}}