{"algorithm":"ai-sow-owner-test-descriptor-v1","contractVersion":"0.2","negativeCases":[{"caseId":"N01","expected":{"diagnosticCodes":["SOURCE_DOCUMENT_HASH_MISMATCH"],"outcome":"BLOCKED","owner":"analyze-requirement","sideEffects":{}},"mutation":{"op":"replace-field","selector":{"collection":"sourceDocuments","field":"sha256","id":"source-document-customer-profile","idField":"sourceDocumentId","path":".ai-sow/data/analyze-requirement/requirements.json"},"value":"0000000000000000000000000000000000000000000000000000000000000000"}}],"ownerSkill":"analyze-requirement","positive":{"operations":[{"op":"replace-field","selector":{"field":"content","mediaType":"text-file","path":".ai-sow/reviews/analyze-requirement-questionnaire.md"},"value":"| Question ID | ARQ-001 |\n| Type | GAP |\n| Source | source-document-customer-profile: section 1 |\n| Gap or conflict | 缺少档案保留范围。 |\n| Business impact | 可能改变业务范围。 |\n| Options | 保留一年或三年。 |\n| Recommendation | 保留一年。 |\n| Rationale | 符合当前业务证据。 |\n| Answer | 用户已确认保留一年。 |\n| Status | APPROVED_DEFAULT |\n| Blocking | NO：已确认不阻塞 |\n| Decision date | 2026-08-23 |\n| Decision evidence | 用户在需求评审中明确确认。 |\n| Disposition | ASSUMPTION_CANDIDATE |\n"},{"op":"replace-review-declaration","selector":{"path":".ai-sow/reviews/analyze-requirement.md","prefix":"Questionnaire: "},"value":"Questionnaire: .ai-sow/reviews/analyze-requirement-questionnaire.md"}]}}