{"algorithm":"ai-sow-owner-test-descriptor-v1","contractVersion":"0.2","negativeCases":[{"caseId":"P01","expected":{"diagnosticCodes":["SCOPE_OBLIGATION_MISSING"],"outcome":"BLOCKED","owner":"generate-design","sideEffects":{}},"mutation":{"op":"remove-by-id","selector":{"collection":"decisions","id":"decision-simulated-push-target","idField":"designDecisionId","path":".ai-sow/data/generate-design/design.json"},"value":{}}},{"caseId":"P02","expected":{"diagnosticCodes":["DECISION_EVIDENCE_REQUIRED"],"outcome":"BLOCKED","owner":"generate-design","sideEffects":{}},"mutation":{"op":"replace-field","selector":{"collection":"decisions","field":"evidenceIds","id":"decision-simulated-threshold-profile-error","idField":"designDecisionId","path":".ai-sow/data/generate-design/design.json"},"value":[]}}],"ownerSkill":"generate-design","positive":{"operations":[{"op":"append-object","selector":{"collection":"decisions","path":".ai-sow/data/generate-design/design.json"},"value":{"decision":"Use SIMULATED_PUSH_SANDBOX as the test-only provider target owned by SIMULATED_DELIVERY_OWNER.","decisionKind":"PROVIDER_TARGET","designDecisionId":"decision-simulated-push-target","designItemIds":["design-integration-adapters"],"effectiveStartItemIds":["effective-start-erp-interface"],"evidenceIds":["evidence-erp-contract"],"rationale":"SIMULATED target exists only to make the test descriptor complete.","relatedFeatureIds":["feature-inventory-reservation"],"title":"SIMULATED PUSH sandbox provider"}},{"op":"append-object","selector":{"collection":"decisions","path":".ai-sow/data/generate-design/design.json"},"value":{"decision":"SIMULATED value=1 SIMULATED_PERCENT; window SIMULATED_5_MIN; operator SIMULATED_GREATER_THAN; owner SIMULATED_RELEASE_OWNER.","decisionKind":"OPERATIONAL_THRESHOLD","designDecisionId":"decision-simulated-threshold-profile-error","designItemIds":["design-release-platform"],"effectiveStartItemIds":["effective-start-deployment-platform"],"evidenceIds":["evidence-platform-config"],"rationale":"SIMULATED operational stop condition.","relatedFeatureIds":["feature-production-scope","feature-customer-profile","feature-member-tier","feature-order-orchestration","feature-inventory-reservation","feature-return-refund","feature-store-order","feature-order-visibility","feature-payment-reconciliation","feature-einvoice","feature-finance-report"],"title":"SIMULATED profile error threshold"}},{"op":"append-object","selector":{"collection":"decisions","path":".ai-sow/data/generate-design/design.json"},"value":{"decision":"SIMULATED value=2 SIMULATED_PERCENT; window SIMULATED_5_MIN; operator SIMULATED_GREATER_THAN; owner SIMULATED_RELEASE_OWNER.","decisionKind":"OPERATIONAL_THRESHOLD","designDecisionId":"decision-simulated-threshold-notification","designItemIds":["design-release-platform"],"effectiveStartItemIds":["effective-start-deployment-platform"],"evidenceIds":["evidence-operations-assets"],"rationale":"SIMULATED operational stop condition.","relatedFeatureIds":["feature-production-scope"],"title":"SIMULATED notification threshold"}},{"op":"append-object","selector":{"collection":"decisions","path":".ai-sow/data/generate-design/design.json"},"value":{"decision":"SIMULATED value=3 SIMULATED_ITEMS; window SIMULATED_10_MIN; operator SIMULATED_GREATER_THAN; owner SIMULATED_OPERATIONS_OWNER.","decisionKind":"OPERATIONAL_THRESHOLD","designDecisionId":"decision-simulated-threshold-backlog","designItemIds":["design-release-platform"],"effectiveStartItemIds":["effective-start-deployment-platform"],"evidenceIds":["evidence-operations-assets"],"rationale":"SIMULATED operational stop condition.","relatedFeatureIds":["feature-production-scope"],"title":"SIMULATED backlog threshold"}},{"op":"append-object","selector":{"collection":"decisions","path":".ai-sow/data/generate-design/design.json"},"value":{"decision":"SIMULATED value=4 SIMULATED_MINUTES; window SIMULATED_10_MIN; operator SIMULATED_GREATER_THAN; owner SIMULATED_CUTOVER_OWNER.","decisionKind":"CUTOVER_ROLLBACK","designDecisionId":"decision-simulated-threshold-telemetry","designItemIds":["design-release-platform"],"effectiveStartItemIds":["effective-start-deployment-platform"],"evidenceIds":["evidence-platform-config"],"rationale":"SIMULATED rollback stop condition.","relatedFeatureIds":["feature-production-scope"],"title":"SIMULATED telemetry rollback threshold"}},{"op":"append-object","selector":{"collection":"decisions","path":".ai-sow/data/generate-design/design.json"},"value":{"decision":"SIMULATED Scheduler and Debezium cover SIMULATED_DEV, SIMULATED_TEST, SIMULATED_UAT, SIMULATED_STAGE, SIMULATED_DR, SIMULATED_PROD; double-enable must fail closed.","decisionKind":"ENVIRONMENT_AUTHORITY","designDecisionId":"decision-simulated-relay-environment","designItemIds":["design-order-domain"],"effectiveStartItemIds":["effective-start-order-service"],"evidenceIds":["evidence-order-service"],"rationale":"SIMULATED relay policy is an atomic test decision.","relatedFeatureIds":["feature-order-orchestration"],"title":"SIMULATED relay environment authority"}},{"op":"replace-field","selector":{"collection":"scopeDecisions","field":"requiredDecisionKinds","id":"feature-inventory-reservation","idField":"featureId","path":".ai-sow/data/generate-design/design.json"},"value":["INTEGRATION_BOUNDARY","PROVIDER_TARGET"]},{"op":"replace-field","selector":{"collection":"scopeDecisions","field":"requiredDecisionKinds","id":"feature-production-scope","idField":"featureId","path":".ai-sow/data/generate-design/design.json"},"value":["OPERATIONAL_THRESHOLD"]}]}}