{"algorithm":"ai-sow-owner-test-descriptor-v1","contractVersion":"0.2","negativeCases":[{"caseId":"N02","expected":{"diagnosticCodes":["TOPIC_ASSESSMENTS_INVALID"],"outcome":"BLOCKED","owner":"analyze-as-is","sideEffects":{}},"mutation":{"op":"remove-by-id","selector":{"collection":"topicAssessments","id":"DELIVERY_CONSTRAINTS","idField":"topic","path":".ai-sow/data/analyze-as-is/asis.json"},"value":{}}},{"caseId":"N03","expected":{"diagnosticCodes":["TOPIC_UNCERTAINTY_REQUIRED"],"outcome":"BLOCKED","owner":"analyze-as-is","sideEffects":{}},"mutation":{"op":"replace-field","selector":{"collection":"topicAssessments","fields":["status","uncertaintyIds"],"id":"OPERATIONS_QUALITY","idField":"topic","path":".ai-sow/data/analyze-as-is/asis.json"},"value":{"status":"INSUFFICIENT_EVIDENCE","uncertaintyIds":[]}}},{"caseId":"N04","expected":{"diagnosticCodes":["SCHEMA_INVALID"],"outcome":"BLOCKED","owner":"analyze-as-is","sideEffects":{"outsidePath":"UNCHANGED"}},"mutation":{"op":"replace-field","selector":{"collection":"repositorySnapshots","field":"path","id":"customer-portal","idField":"repoId","path":".ai-sow/data/analyze-as-is/asis.json"},"value":"../outside-repository"}},{"caseId":"N10","expected":{"diagnosticCodes":["ANCHOR_FILE_MISSING"],"outcome":"BLOCKED","owner":"analyze-as-is","sideEffects":{}},"mutation":{"op":"replace-anchor","selector":{"evidenceId":"evidence-order-service","path":".ai-sow/data/analyze-as-is/asis.json"},"value":"customer-portal:src/does-not-exist.ts#L1"}}],"ownerSkill":"analyze-as-is","positive":{"operations":[{"op":"replace-anchor","selector":{"evidenceId":"evidence-order-service","path":".ai-sow/data/analyze-as-is/asis.json"},"value":"customer-portal:src/order/state-machine.ts#L20"}]}}