{"algorithm":"ai-sow-owner-test-descriptor-v1","contractVersion":"0.2","negativeCases":[{"caseId":"N05","expected":{"diagnosticCodes":["HLD_GATE_NOT_PASSED","OWNER_RECEIPT_INPUT_MISMATCH"],"outcome":"BLOCKED","owner":"generate-story","sideEffects":{}},"mutation":{"op":"replace-review-declaration","selector":{"path":".ai-sow/reviews/generate-design.md","prefix":"HLD Coverage: "},"value":"HLD Coverage: BLOCKED"}},{"caseId":"N06","expected":{"diagnosticCodes":["AC_COVERAGE_MISSING","REQUIRED_DECISION_KIND_UNCOVERED"],"outcome":"BLOCKED","owner":"generate-story","sideEffects":{}},"mutation":{"op":"remove-by-id","selector":{"collection":"acceptanceCriteria","id":"story-production-preparation","idField":"storyId","match":"all","path":".ai-sow/data/generate-story/delivery.json"},"value":{}}},{"caseId":"N09","expected":{"diagnosticCodes":["QUESTIONNAIRE_DECLARATION_CONFLICT"],"outcome":"BLOCKED","owner":"generate-story","sideEffects":{}},"mutation":{"op":"replace-review-declaration","selector":{"path":".ai-sow/reviews/analyze-requirement.md","prefix":"Questionnaire: "},"value":"Questionnaire: NOT_REQUIRED"}}],"ownerSkill":"generate-story","positive":{"operations":[{"op":"replace-field","selector":{"collection":"acceptanceCriteria","field":"approvalDecisionIds","id":"ac-inventory-reservation","idField":"acceptanceCriterionId","path":".ai-sow/data/generate-story/delivery.json"},"value":["decision-integration-boundary","decision-simulated-push-target"]},{"op":"replace-field","selector":{"collection":"integrations","fields":["target","targetKind","decisionIds"],"id":"integration-erp-reservation","idField":"integrationId","path":".ai-sow/data/generate-story/delivery.json"},"value":{"decisionIds":["decision-integration-boundary","decision-simulated-push-target"],"target":"SIMULATED_PUSH_SANDBOX","targetKind":"PROVIDER"}},{"op":"append-object","selector":{"collection":"integrations","path":".ai-sow/data/generate-story/delivery.json"},"value":{"decisionIds":["decision-simulated-threshold-profile-error"],"deliveryBoundary":"END_TO_END","direction":"OUTBOUND","integrationId":"integration-simulated-production-threshold","name":"SIMULATED production threshold integration","owner":"INTERNAL","purpose":"SIMULATED production threshold gate consumption.","source":"SIMULATED release controller","storyId":"story-production-preparation","target":"SIMULATED observability gate","targetKind":"SYSTEM","trigger":"SIMULATED production release begins"}},{"op":"replace-field","selector":{"collection":"acceptanceCriteria","field":"approvalDecisionIds","id":"ac-production-preparation","idField":"acceptanceCriterionId","path":".ai-sow/data/generate-story/delivery.json"},"value":["decision-profile-api","decision-simulated-push-target","decision-simulated-relay-environment","decision-simulated-threshold-profile-error","decision-simulated-threshold-notification","decision-simulated-threshold-backlog","decision-simulated-threshold-telemetry"]},{"op":"replace-field","selector":{"collection":"acceptanceCriteria","field":"approvalDecisionIds","id":"ac-production-cutover","idField":"acceptanceCriterionId","path":".ai-sow/data/generate-story/delivery.json"},"value":["decision-profile-api","decision-simulated-push-target","decision-simulated-relay-environment","decision-simulated-threshold-profile-error","decision-simulated-threshold-notification","decision-simulated-threshold-backlog","decision-simulated-threshold-telemetry"]},{"op":"replace-field","selector":{"collection":"acceptanceCriteria","field":"approvalDecisionIds","id":"ac-production-validation","idField":"acceptanceCriterionId","path":".ai-sow/data/generate-story/delivery.json"},"value":["decision-profile-api","decision-simulated-push-target","decision-simulated-relay-environment","decision-simulated-threshold-profile-error","decision-simulated-threshold-notification","decision-simulated-threshold-backlog","decision-simulated-threshold-telemetry"]},{"op":"replace-field","selector":{"collection":"acceptanceCriteria","field":"approvalDecisionIds","id":"ac-test-automation","idField":"acceptanceCriterionId","path":".ai-sow/data/generate-story/delivery.json"},"value":["decision-profile-api","decision-integration-boundary","decision-simulated-push-target"]},{"op":"replace-field","selector":{"collection":"acceptanceCriteria","field":"approvalDecisionIds","id":"ac-test-non-uat","idField":"acceptanceCriterionId","path":".ai-sow/data/generate-story/delivery.json"},"value":["decision-profile-api","decision-integration-boundary","decision-simulated-push-target"]},{"op":"append-object","selector":{"collection":"acceptanceCriteria","path":".ai-sow/data/generate-story/delivery.json"},"value":{"acceptanceCriterionId":"ac-simulated-scheduler-six-environment","approvalDecisionIds":["decision-simulated-relay-environment"],"decisionGate":"REQUIRED","name":"SIMULATED Scheduler is configured in all six environments.","sequence":2,"storyId":"story-order-state"}},{"op":"append-object","selector":{"collection":"acceptanceCriteria","path":".ai-sow/data/generate-story/delivery.json"},"value":{"acceptanceCriterionId":"ac-simulated-debezium-six-environment","approvalDecisionIds":["decision-simulated-relay-environment"],"decisionGate":"REQUIRED","name":"SIMULATED Debezium is configured in all six environments.","sequence":3,"storyId":"story-order-state"}},{"op":"append-object","selector":{"collection":"acceptanceCriteria","path":".ai-sow/data/generate-story/delivery.json"},"value":{"acceptanceCriterionId":"ac-simulated-double-enable-fail-closed","approvalDecisionIds":["decision-simulated-relay-environment"],"decisionGate":"REQUIRED","name":"SIMULATED double-enable fails closed.","sequence":4,"storyId":"story-order-state"}},{"op":"append-object","selector":{"collection":"assumptions","path":".ai-sow/data/generate-story/delivery.json"},"value":{"assumptionId":"assumption-arq-001","handling":"来源：analyze-requirement-questionnaire#ARQ-001","name":"档案保留一年","responsibilityBoundary":"业务负责人确认保留期。","status":"已明确","trigger":"客户档案进入交付范围。","type":"假设"}},{"op":"replace-field","selector":{"collection":"stories","field":"assumptionId","id":"story-customer-profile","idField":"storyId","path":".ai-sow/data/generate-story/delivery.json"},"value":"assumption-arq-001"},{"op":"replace-field","selector":{"collection":"assumptions","fieldMap":{"evidence":"handling","riskId":"assumptionId","status":"status"},"idField":"assumptionId","mediaType":"risk-resolution-projection","path":".ai-sow/data/generate-story/delivery.json"},"value":{}}],"riskResolutions":[{"evidence":"SIMULATED PROFILE RISK RESOLUTION — NOT PRODUCTION","riskId":"assumption-risk-profile-alert-channel","status":"已明确"},{"evidence":"SIMULATED PAYMENT RISK RESOLUTION — NOT PRODUCTION","riskId":"assumption-risk-payment-certification","status":"已明确"},{"evidence":"SIMULATED INVOICE RISK RESOLUTION — NOT PRODUCTION","riskId":"assumption-risk-invoice-certificate","status":"已明确"}]}}